smartctl 6.4 2015-06-04 r4109 [x86_64-linux-4.3.3.201512162141-1-grsec] (local build)
Copyright (C) 2002-15, Bruce Allen, Christian Franke, www.smartmontools.org

=== START OF INFORMATION SECTION ===
Device Model:     SanDisk SDSSDA120G
Serial Number:
LU WWN Device Id:
Firmware Version: Z22000RL
User Capacity:    120,034,123,776 bytes [120 GB]
Sector Size:      512 bytes logical/physical
Rotation Rate:    Solid State Device
Form Factor:      1.8 inches
Device is:        Not in smartctl database [for details use: -P showall]
ATA Version is:   ACS-2 T13/2015-D revision 3
SATA Version is:  SATA 3.2, 6.0 Gb/s (current: 6.0 Gb/s)
Local Time is:    Sat Dec 26 21:28:20 2015 UTC
SMART support is: Available - device has SMART capability.
SMART support is: Enabled

=== START OF READ SMART DATA SECTION ===
SMART overall-health self-assessment test result: PASSED

General SMART Values:
Offline data collection status:  (0x00)	Offline data collection activity
					was never started.
					Auto Offline Data Collection: Disabled.
Self-test execution status:      (   0)	The previous self-test routine completed
					without error or no self-test has ever
					been run.
Total time to complete Offline
data collection: 		(    0) seconds.
Offline data collection
capabilities: 			 (0x71) SMART execute Offline immediate.
					No Auto Offline data collection support.
					Suspend Offline collection upon new
					command.
					No Offline surface scan supported.
					Self-test supported.
					Conveyance Self-test supported.
					Selective Self-test supported.
SMART capabilities:            (0x0002)	Does not save SMART data before
					entering power-saving mode.
					Supports SMART auto save timer.
Error logging capability:        (0x01)	Error logging supported.
					General Purpose Logging supported.
Short self-test routine
recommended polling time: 	 (   2) minutes.
Extended self-test routine
recommended polling time: 	 (  10) minutes.
Conveyance self-test routine
recommended polling time: 	 (   2) minutes.

SMART Attributes Data Structure revision number: 1
Vendor Specific SMART Attributes with Thresholds:
ID# ATTRIBUTE_NAME          FLAG     VALUE WORST THRESH TYPE      UPDATED  WHEN_FAILED RAW_VALUE
  5 Reallocated_Sector_Ct   0x0032   100   100   000    Old_age   Always       -       0
  9 Power_On_Hours          0x0032   000   100   000    Old_age   Always       -       0
 12 Power_Cycle_Count       0x0032   100   100   000    Old_age   Always       -       8
166 Unknown_Attribute       0x0032   100   100   000    Old_age   Always       -       0
167 Unknown_Attribute       0x0032   100   100   000    Old_age   Always       -       0
168 Unknown_Attribute       0x0032   100   100   000    Old_age   Always       -       2
169 Unknown_Attribute       0x0032   100   100   000    Old_age   Always       -       22
170 Unknown_Attribute       0x0032   100   100   000    Old_age   Always       -       0
171 Unknown_Attribute       0x0032   100   100   000    Old_age   Always       -       0
172 Unknown_Attribute       0x0032   100   100   000    Old_age   Always       -       0
173 Unknown_Attribute       0x0032   100   100   ---    Old_age   Always       -       0
174 Unknown_Attribute       0x0032   100   100   000    Old_age   Always       -       7
187 Reported_Uncorrect      0x0032   100   100   000    Old_age   Always       -       0
194 Temperature_Celsius     0x0022   072   100   000    Old_age   Always       -       28 (Min/Max 0/30)
199 UDMA_CRC_Error_Count    0x0032   100   100   000    Old_age   Always       -       0
230 Unknown_SSD_Attribute   0x0032   100   100   000    Old_age   Always       -       0
232 Available_Reservd_Space 0x0033   100   100   004    Pre-fail  Always       -       100
233 Media_Wearout_Indicator 0x0032   100   100   000    Old_age   Always       -       0
241 Total_LBAs_Written      0x0030   253   253   000    Old_age   Offline      -       0
242 Total_LBAs_Read         0x0030   253   253   000    Old_age   Offline      -       0

SMART Error Log Version: 1
No Errors Logged

SMART Self-test log structure revision number 1
No self-tests have been logged.  [To run self-tests, use: smartctl -t]

SMART Selective self-test log data structure revision number 1
 SPAN  MIN_LBA  MAX_LBA  CURRENT_TEST_STATUS
    1        0        0  Not_testing
    2        0        0  Not_testing
    3        0        0  Not_testing
    4        0        0  Not_testing
    5        0        0  Not_testing
Selective self-test flags (0x0):
  After scanning selected spans, do NOT read-scan remainder of disk.
If Selective self-test is pending on power-up, resume after 0 minute delay.

